phrase_woodruff,phrases_scriptures,similarity_scores
the ungodly thy brethren have rejected you and your testimony even the nation that has,"rejected you and your testimony, even the nation that has driven you out; and now",0.6812146555431824
of the church of jesus christ of latter day saints i received a letter from,"of this church of jesus christ of latter-day saints! and the voice of michael, the",0.6800719391798987
the wicked but hearken and hear o ye apostles elders and people of my church,"hearken, o ye people of my church, saith the lord your god, and hear the",0.6800484685705831
the lord to my servant wilford i the lord have heard thy prayers and thy,thus saith the lord unto you my servant thomas: i have heard thy prayers; and,0.6791991916979904
that we as a people as the church of jesus christ of latter day saints,"people of the church of jesus christ of latter-day saints, and those who journey with",0.6782766109601747
my servant john taylor 1808 and my servant wilford odruff and my servant orson pratt,"and my servant sidney, and my servant hyrum, cannot come; for on them have i",0.6776991924958712
and waste ^away^ mine enemies and not many years hence they shall not be left,have sent forth to destroy and lay waste mine enemies; and not many years hence,0.6770800392936456
1808 to be the president of the church of jesus christ of latter day saints,"people of the church of jesus christ of latter-day saints, and those who journey with",0.6769726060132983
and from the west and that that the north shall give up and the south,"who come from the east, and the west, and the north, and the south, that",0.6769167114686059
unto my servant john taylor 1808 and my servant wilford odruff and my servant orson,"and my servant sidney, and my servant hyrum, cannot come; for on them have i",0.6764517913674242
for i am the lord your god even the god of your fathers the god,"and by oppression, saith the lord your god. for i am the lord your god,",0.6761543508098795
brigham young be the president of the church of jesus christ of latter day saints,"people of the church of jesus christ of latter-day saints, and those who journey with",0.6758545761208727
last days to sta turn the hearts of the fathers to the children and the,"lord come-- to turn the hearts of the fathers to the children, and the children",0.6748176883290053
rk of god in this great and last dispensation of the fulness of times the,"last time, in the which is the dispensation of the fulness of times, which power",0.6742607874216666
may see and his ears opened that he may hear for my spirit is sent,"his god, that his eyes may be opened that he may see, and his ears",0.6740845115999917
be the president of the church of jesus christ of latter day saints it was,"lord, prophet and seer of the church of jesus christ of latter-day saints. as i",0.6730929562886072
before thee in this holy house which we have built unto thy name and stretch,"house unto thee, the work of our hands, which we have built unto thy name;",0.6730099747555561
lord come and he shall turn the hearts of the fathers to the children and,"of the children to their fathers, and the hearts of the fathers to the children;",0.672659211922676
of the church of jesus christ of latter day saints i received a letter from,"lord, prophet and seer of the church of jesus christ of latter-day saints. as i",0.6725705345130943
the death of the prophet and patriarch joseph smith jr and hyrum smith who were,"the martyrdom of joseph smith the prophet, and hyrum smith the patriarch. they were shot",0.671995313439196
1808 to be the president of the church of jesus christ of latter day saints,"of this church of jesus christ of latter-day saints! and the voice of michael, the",0.6719022144585572
the remission of sins and hands laid upon him for the gift of the holy,"sin, vicarious baptism for the remission of sins, the gift of the holy ghost by",0.6713586840172064
president of the church of jesus christ of latter day saints in his day franklin,"people of the church of jesus christ of latter-day saints, and those who journey with",0.6710551276451009
of the church of jesus christ of latter day saints met at the tabernacle salt,"people of the church of jesus christ of latter-day saints, and those who journey with",0.6709890208323187
life as the president of the church of jesus christ of latter day saints where,"lord, prophet and seer of the church of jesus christ of latter-day saints. as i",0.670861700581328
brigham young be the president of the church of jesus christ of latter day saints,"of this church of jesus christ of latter-day saints! and the voice of michael, the",0.6707925583899379
say through m his servant joseph smith jr let my servant brigham young give again,"my servant parley p. pratt journey with my servant joseph smith, jun. let my servant",0.6685989443390483
to ask the father in the name of thy son jesus christ for all blessings,"now we ask thee, holy father, in the name of jesus christ, the son of",0.668432290878055
seer and revelator in the church and kingdom of god and over the house of,"over all my church, to be a translator, a revelator, a seer, and prophet. i",0.6680328706703461
april i received the ordinance of the washing of feet under the hands of elder,"washing of feet, for unto this end was the ordinance of the washing of feet",0.6670952688370434
the general conference of the church of jesus christ of latter day saints met this,"of this church of jesus christ of latter-day saints! and the voice of michael, the",0.6669550738577137
the lord to my servant wilford i the lord have heard thy prayers and thy,"answer to thy prayers. i know thy heart, and have heard thy prayers concerning thy",0.6664527696260057
last time to preach the gospel of jesus christ to warn the nations that they,"it just to preach the gospel to the nations of the earth, and warn the",0.6661110157216656
and thoughts and intents of the hearts of the twelve apostle and others of who,"the secret acts of men, and the thoughts and intents of their hearts, and the",0.6661088587374311
of the church of jesus christ of latter day saints met at the tabernacle salt,"of this church of jesus christ of latter-day saints! and the voice of michael, the",0.6659634451526945
children and the hearts of the children to their fathers lest i come and smite,"lord come-- to turn the hearts of the fathers to the children, and the children",0.6658304145880373
spencer president of the stake also joseph young and 4 of his counselors meeting opened,"and his counselors, and also the president of the stake and his counselors. the above",0.665812174318266
lord unto my servant wilford odruff i have heard thy prayers and will answer thy,thus saith the lord unto you my servant thomas: i have heard thy prayers; and,0.6645797829385003
wilderness prepare ye the way of the lord and make his paths strait and they,"saying: prepare ye the way of the lord, and make his paths straight, for the",0.6636236366271814
a conference of the church of jesus christ of latter day saints was held at,"people of the church of jesus christ of latter-day saints, and those who journey with",0.6632636739090565
the office of a patriarch in the church of jesus christ of latter day saints,"people of the church of jesus christ of latter-day saints, and those who journey with",0.6626437579886355
borrowed and if thou canst not repay then go straitway and tell thy neighbor lest,"not repay then go straightway and tell thy neighbor, lest he condemn thee. if thou",0.6618870741889669
of the church of jesus christ of latter day saints met this sunday morning at,"people of the church of jesus christ of latter-day saints, and those who journey with",0.6616587665846655
the lord jesus christ and a member of the church of jesus christ of latter,"lord, prophet and seer of the church of jesus christ of latter-day saints. as i",0.661413871924066
the most nderful events of the last dispensation and fulness of times in which we,"last time, in the which is the dispensation of the fulness of times, which power",0.6613822252232167
they feel thy power and be constrained to acknowledge that the power of god rests,"the lord's house may feel thy power, and feel constrained to acknowledge that thou hast",0.6606867649010495
keys of the holy priesthood even to be prophet seer and revelator in the church,"over all my church, to be a translator, a revelator, a seer, and prophet. i",0.6605345936215317
no man can loose them then shall the curtain of heaven be unfolded as a,"of half an hour; and immediately after shall the curtain of heaven be unfolded, as",0.6595146454408354
over you and your acts therefore be faithful until i come i come quickly to,"generation be required at your hands. be faithful until i come, for i come quickly;",0.6591258525779103
the right hand of thy power he has been with thy people through all their,"all the presidents of thy church, that thy right hand may exalt them, with all",0.6589438092622312
general conference of the church of jesus christ of latter day saints met this day,"of this church of jesus christ of latter-day saints! and the voice of michael, the",0.6589262858236157
1808 to be the president of the church of jesus christ of latter day saints,"lord, prophet and seer of the church of jesus christ of latter-day saints. as i",0.6588150455457703
president of the church of jesus christ of latter day saints in his day franklin,"of this church of jesus christ of latter-day saints! and the voice of michael, the",0.6581049585261368
brigham young be the president of the church of jesus christ of latter day saints,"lord, prophet and seer of the church of jesus christ of latter-day saints. as i",0.6577270031228463
the office of a patriarch in the church of jesus christ of latter day saints,"of this church of jesus christ of latter-day saints! and the voice of michael, the",0.6576806866849177
the prophet i received the ordinance of washing of feet under the hands of heber,"washing of feet, for unto this end was the ordinance of the washing of feet",0.6574602072611186
and progress of the church of jesus christ of latter day saints he spoke of,"people of the church of jesus christ of latter-day saints, and those who journey with",0.657340387359202
the remission of sins for the receiving of the holy ghost and it was the,"sin, vicarious baptism for the remission of sins, the gift of the holy ghost by",0.6570257284881044
preach the gospel to them in their own language and tongue and the power of,"of the gospel in his own tongue, and in his own language, through those who",0.6568639431195938
my sake for he that layeth down his life for my shake shall find it,"herewith. and whoso layeth down his life in my cause, for my name's sake, shall",0.6562618490079573
against them therefore marvel not at these things for ye are not yet pure thou,"at these things, for ye are not yet pure; ye can not yet bear my",0.6560100999847283
and progress of the church of jesus christ of latter day saints he spoke of,"of this church of jesus christ of latter-day saints! and the voice of michael, the",0.6554830580657
thousand miles to preach the gospel to the nations of the earth and that to,"it just to preach the gospel to the nations of the earth, and warn the",0.6541078905825107
to be full of the holy ghost and the power of god while at the,"and by the power of the holy ghost, which shall be in you at the",0.6538821224262228
in heaven and what they loosed on earth should be loosed 1862 in heaven and,"bound in heaven, and whatsoever you loose on earth shall be loosed in heaven. or,",0.6537767847460291
15th i met in council with the president and council captains of hundreds fifties and,"hundreds, captains of fifties, and captains of tens, with a president and his two counselors",0.6537506351326127
be the president of the church of jesus christ of latter day saints it was,"of my church of jesus christ of latter-day saints, scattered abroad in all the world;",0.6534556441266597
my servant john taylor 1808 and my servant wilford odruff and my servant orson pratt,"mission in store for my servant william, and my servant hyrum, and for them alone;",0.6532667147431407
to to the church of jesus christ of latter day saints o i have herd,"people of the church of jesus christ of latter-day saints, and those who journey with",0.6531307994457125
president of the church of jesus christ of latter day saints in his day franklin,"lord, prophet and seer of the church of jesus christ of latter-day saints. as i",0.6530562840448898
of the church of jesus christ of latter day saints met at the tabernacle salt,"lord, prophet and seer of the church of jesus christ of latter-day saints. as i",0.6529919503296299
th gates of hell shall not prevail against it what rock revelation again he says,rock i will build my church; and the gates of hell shall not prevail against,0.6529693177021226
of the church of jesus christ of latter day saints i received a letter from,"of my church of jesus christ of latter-day saints, scattered abroad in all the world;",0.6529484638707468
a conference of the church of jesus christ of latter day saints was held at,"of this church of jesus christ of latter-day saints! and the voice of michael, the",0.6526729962111171
church of jesus christ of latter day saints met this morning in the tabernacle of,"people of the church of jesus christ of latter-day saints, and those who journey with",0.6523063664782466
unto my servant john taylor 1808 and my servant wilford odruff and my servant orson,"mission in store for my servant william, and my servant hyrum, and for them alone;",0.6520642850425143
of the sacrifice of the church of jesus christ of latter day saints through the,"of this church of jesus christ of latter-day saints! and the voice of michael, the",0.6519298863660178
the church of jesus christ of latter day saints with myself the last of dec,"people of the church of jesus christ of latter-day saints, and those who journey with",0.6514241330379141
to be a member in the church of jesus christ of latter day saints and,"people of the church of jesus christ of latter-day saints, and those who journey with",0.6507788012459036
it may be sanctified and holy unto thy name and we pray that we may,"may be sanctified and consecrated to be holy, and that thy holy presence may be",0.6506276777705788
church of jesus christ of latter day saints was organized and to day is the,"people of the church of jesus christ of latter-day saints, and those who journey with",0.6503216816672877
unto my servant john taylor 1808 and my servant wilford odruff and my servant orson,"give unto him for counselors my servant sidney rigdon and my servant william law, that",0.6498579645938889
president of the church of jesus christ of latter day saints in his day franklin,"of my church of jesus christ of latter-day saints, scattered abroad in all the world;",0.6496237489139597
unto my servant john taylor 1808 and my servant wilford odruff and my servant orson,"if my servant sidney will serve me and be counselor unto my servant joseph, let",0.6486930624979994
are ye ingaged in the great rk with us ye will say yes can ye,"ye, prepare ye, o my people; sanctify yourselves; gather ye together, o ye people of",0.6480350767421349
church of jesus christ of latter day saints april 7 1889 this 7 day of,"of this church of jesus christ of latter-day saints! and the voice of michael, the",0.6471738369913317
it together an angel shall sound his trump that all nations will hear it saying,"and again, another angel shall sound his trump, which is the seventh angel, saying: it",0.6470292759298978
pay your debts if you say you cant pay i say you shall pay them,"say unto you, concerning your debts--behold it is my will that you shall pay all",0.6460391031533381
a conference of the church of jesus christ of latter day saints was held at,"lord, prophet and seer of the church of jesus christ of latter-day saints. as i",0.645473810393247
be a member in the church of jesus christ of latter day saints and we,"people of the church of jesus christ of latter-day saints, and those who journey with",0.6452361243741206
heber chase kimball orson hyde parley parker pratt orson pratt willard richards woodruff john taylor,"to every creature. they are heber c. kimball, parley p. pratt, orson pratt, orson hyde,",0.6450156258340908
speaks and her voice is as the voice of god she has a spirit which,"shall be a voice as the voice of many waters, and as the voice of",0.6449721940984494
the office of a patriarch in the church of jesus christ of latter day saints,"lord, prophet and seer of the church of jesus christ of latter-day saints. as i",0.6448705216756253
of praise and thanksgiving if thou art sorrowful call on the lord thy god with,"thou art sorrowful, call on the lord thy god with supplication, that your souls may",0.6442406299709192
of the church of jesus christ of latter day saints met this sunday morning at,"lord, prophet and seer of the church of jesus christ of latter-day saints. as i",0.643911949421882
in heaven and what they loosed on earth should be loosed 1862 in heaven and,heaven; and whatsoever he shall loose on earth shall be loosed in heaven. and from,0.6437248488348254
unto my servant john taylor 1808 and my servant wilford odruff and my servant orson,"servant william be appointed, ordained, and anointed, as counselor unto my servant joseph, in the",0.643423114364085
to the several stakes of zion a presiding high priest presides over the high priest,"in other words, the presiding high priest over the high priesthood of the church. from",0.6433696122675227
the authorities of the church of jesus christ of latter day saints on the temple,"of this church of jesus christ of latter-day saints! and the voice of michael, the",0.6433488395872938
of the sacrifice of the church of jesus christ of latter day saints through the,"people of the church of jesus christ of latter-day saints, and those who journey with",0.6430677587265368
the authorities of the church of jesus christ of latter day saints on the temple,"people of the church of jesus christ of latter-day saints, and those who journey with",0.6428215161812197
church of jesus christ of latter day saints and the kingdom of god from off,"people of the church of jesus christ of latter-day saints, and those who journey with",0.6426120029806446
your houses and in your famili let my servants ezra taft benson and erastus snow,and in your families. let my servants ezra t. benson and erastus snow organize a,0.6425751024248669
what you record on earth shall be recorded in heaven president brigham young has also,"shall be recorded in heaven, and whatsoever you do not record on earth shall not",0.6425564794378885
to take all the property of the church of jesus christ of latter day saints,"of my church of jesus christ of latter-day saints, scattered abroad in all the world;",0.6423217976429734
the office of a patriarch in the church of jesus christ of latter day saints,"of my church of jesus christ of latter-day saints, scattered abroad in all the world;",0.6421208726687295
thou hast spoken well i have all thou hast said in my heart i have,"and that thou hast put forth thy hand, to fulfil that which thou hast spoken",0.6411816686982276
appointed to go to the nations of the earth to preach the gospel o pratt,"it just to preach the gospel to the nations of the earth, and warn the",0.6404090889823618
and progress of the church of jesus christ of latter day saints he spoke of,"lord, prophet and seer of the church of jesus christ of latter-day saints. as i",0.6397093964960525
theretounto even to be a prophet seer and revelator in the church and kingdom of,"over all my church, to be a translator, a revelator, a seer, and prophet. i",0.6396878749162839
1808 to be the president of the church of jesus christ of latter day saints,"of my church of jesus christ of latter-day saints, scattered abroad in all the world;",0.639594287721018
rk of god in this great and last dispensation of the fulness of times the,"sucklings in this, the dispensation of the fulness of times. now, what do we hear",0.639504854063371
brigham young be the president of the church of jesus christ of latter day saints,"of my church of jesus christ of latter-day saints, scattered abroad in all the world;",0.6385379886531606
general conference of the church of jesus christ of latter day saints met at the,"people of the church of jesus christ of latter-day saints, and those who journey with",0.6378699605596253
power of god in this the last dispensation and fulness of times in the which,"the keys of the kingdom, and of the dispensation of the fulness of times! and",0.6378526647058457
life as the president of the church of jesus christ of latter day saints where,"people of the church of jesus christ of latter-day saints, and those who journey with",0.6376418231788792
children and the hearts of the children unto the fathers even those who are in,"lord come-- to turn the hearts of the fathers to the children, and the children",0.6375634637210779
"ghost predicted whatsoever should befall his posterity unto the latest generation"" there was adam and",should befall his posterity unto the latest generation. these things were all written in the,0.6372208211473385
and will of god and be prepared for that which is to come therefore let,may be prepared for that which is in store for a time to come. let,0.6370678780648782
been a member and bishop of the church of jesus christ of latter day saints,"people of the church of jesus christ of latter-day saints, and those who journey with",0.6368665444838469
and the promises of god concerning the great last dispensation of the fulness of times,"the keys of the kingdom, and of the dispensation of the fulness of times! and",0.636249860784459
the church without writing the history of the prophet and president of the church president,"name of the church. the president of the church, who is also the president of",0.6356151781351642
to to the church of jesus christ of latter day saints o i have herd,"lord, prophet and seer of the church of jesus christ of latter-day saints. as i",0.6356127169135702
my servant john taylor 1808 and my servant wilford odruff and my servant orson pratt,"at this time, and also my servant edward partridge, and also my aged servant joseph",0.6350020192735896
church of jesus christ of latter day saints met this morning in the tabernacle of,"lord, prophet and seer of the church of jesus christ of latter-day saints. as i",0.6348103966450898
in this house may the spirit of the lord rest upon thy people that they,"thy people, into this house, may be in the name of the lord; that all",0.6347489407029132
her father o god i ask thee in the name of christ to save the,"now we ask thee, holy father, in the name of jesus christ, the son of",0.6345764768653448
of the twelve apostles of the church of jesus christ of latter day saints chosen,"of this church of jesus christ of latter-day saints! and the voice of michael, the",0.6343767598533766
general conference of the church of jesus christ of latter day saints met this day,"people of the church of jesus christ of latter-day saints, and those who journey with",0.6342179362617338
power of god in this the last dispensation and fulness of times in the which,"sucklings in this, the dispensation of the fulness of times. now, what do we hear",0.6340997251186185
the camp of israel and the whole church of jesus christ of latter day saints,"people of the church of jesus christ of latter-day saints, and those who journey with",0.634070783998865
of my life and the history of the church of jesus christ of latter day,"of this church of jesus christ of latter-day saints! and the voice of michael, the",0.6340241096407057
to take all the property of the church of jesus christ of latter day saints,"people of the church of jesus christ of latter-day saints, and those who journey with",0.6339433186406684
of the church of jesus christ of latter day saints met at the tabernacle salt,"of my church of jesus christ of latter-day saints, scattered abroad in all the world;",0.6339410797952431
unto my servant john taylor 1808 and my servant wilford odruff and my servant orson,"at this time, and also my servant edward partridge, and also my aged servant joseph",0.6338332083259317
to be a member in the church of jesus christ of latter day saints and,"lord, prophet and seer of the church of jesus christ of latter-day saints. as i",0.6333238033188888
the general conference of the church of jesus christ of latter day saints met this,"people of the church of jesus christ of latter-day saints, and those who journey with",0.63327504026537
general conference of the church of jesus christ of latter day saints met at the,"of this church of jesus christ of latter-day saints! and the voice of michael, the",0.633092440121847
church of jesus christ of latter day saints was organized and to day is the,"lord, prophet and seer of the church of jesus christ of latter-day saints. as i",0.6328789444673923
life as the president of the church of jesus christ of latter day saints where,"of this church of jesus christ of latter-day saints! and the voice of michael, the",0.6328660114451731
church of jesus christ of latter day saints met this morning in the tabernacle of,"of my church of jesus christ of latter-day saints, scattered abroad in all the world;",0.6322630995897477
to to the church of jesus christ of latter day saints o i have herd,"of this church of jesus christ of latter-day saints! and the voice of michael, the",0.6321648740206105
east north and west and by the mountain on the south it is open and,"who come from the east, and the west, and the north, and the south, that",0.6321573977855033
ministry as a member of the church of jesus christ of latter day saints i,"lord, prophet and seer of the church of jesus christ of latter-day saints. as i",0.6318456470353261
