phrase_woodruff,phrases_scriptures,similarity_scores
passed through the whole history of the church of jesus christ of latter day saints,"of this church of jesus christ of latter-day saints! and the voice of michael, the",0.6025886352955403
life as the president of the church of jesus christ of latter day saints where,"of my church of jesus christ of latter-day saints, scattered abroad in all the world;",0.6024351119891772
dispensation and fulness of times for the gathering of thy saints o god of israel,"the keys of the kingdom, and of the dispensation of the fulness of times! and",0.6023585474468707
my servant john taylor 1808 and my servant wilford odruff and my servant orson pratt,"servant hyrum to accomplish the work that my servant joseph shall point out to them,",0.6023127257518952
it be in the days of the coming of the son of man first to,"know the time of the coming of the son of man, when i heard a",0.6022579634959266
of praise and thanksgiving if thou art sorrowful call on the lord thy god with,"lord thy god, and thou art his steward. if thou art merry, praise the lord",0.6017241745228923
am in the father and the father in me now i do not suppose that,"the father in me, and the father and i are one-- the father because he",0.60126659230502
unto my servant john taylor 1808 and my servant wilford odruff and my servant orson,"servant hyrum to accomplish the work that my servant joseph shall point out to them,",0.6012040840682392
the rks published by the church of jesus christ of latter day saints and we,"people of the church of jesus christ of latter-day saints, and those who journey with",0.6009767013076294
my servant john taylor 1808 and my servant wilford odruff and my servant orson pratt,"servant william be appointed, ordained, and anointed, as counselor unto my servant joseph, in the",0.6006693585402163
ministry as a member of the church of jesus christ of latter day saints i,"people of the church of jesus christ of latter-day saints, and those who journey with",0.6001038690053907
church of jesus christ of latter day saints i met with my councillers at the,"people of the church of jesus christ of latter-day saints, and those who journey with",0.6000426825716715
